{
  "test_id": "basic-registered-call",
  "overall_verdict": "insufficient_evidence",
  "overall_failure_stage": "unknown",
  "coverage": "partial",
  "gaps": [
    {
      "kind": "placeholder",
      "skill": "02-call-flow",
      "fact": "Skill #2 (Call Setup & Teardown) returned a placeholder finding; its scope was not analyzed.",
      "closing_action": "Implement skill #2 (Call Setup & Teardown) and re-run the test."
    }
  ],
  "summary": "Registration passed; the call was not analyzed because skill #2 is a placeholder.",
  "plan": [
    "01-registration",
    "02-call-flow"
  ],
  "findings": [
    {
      "skill": "01-registration",
      "test_id": "basic-registered-call",
      "summary": "Users 1001 and 1002 registered after a normal digest challenge.",
      "verdict": "pass",
      "failure_stage": "none",
      "confidence": 0.9,
      "evidence": [
        {
          "frame": 7,
          "field": "sip.auth.username",
          "value": "1001"
        },
        {
          "frame": 8,
          "field": "sip.Status-Code",
          "value": "200"
        },
        {
          "frame": 8,
          "field": "sip.Contact",
          "value": "<sip:1001@192.168.56.21:5060;transport=udp>;expires=3600"
        },
        {
          "frame": 3,
          "field": "sip.auth.username",
          "value": "1002"
        },
        {
          "frame": 4,
          "field": "sip.Status-Code",
          "value": "200"
        },
        {
          "frame": 4,
          "field": "sip.Contact",
          "value": "<sip:1002@192.168.56.22:5060;transport=udp>;expires=3600"
        }
      ],
      "rfc_ref": [
        "RFC 3261 §10.2",
        "RFC 3261 §10.3",
        "RFC 3261 §22.2",
        "RFC 3261 §21.4.2"
      ],
      "next_check": null,
      "rationale": "User 1001: REGISTER (frame 5) was challenged with 401 (frame 6); the credentialed REGISTER (frame 7) was accepted with 200, Contact expires=3600 (frame 8). User 1002: REGISTER (frame 1) was challenged with 401 (frame 2); the credentialed REGISTER (frame 3) was accepted with 200, Contact expires=3600 (frame 4). Expected: a challenged REGISTER is retried with credentials and accepted with 200, which lists the granted binding (RFC 3261 §10.3, §22.2). The initial 401 responses are normal challenges.",
      "registrations": [
        {
          "user": "1001",
          "call_id": "Qx81vN3pTa",
          "request_frames": [
            5,
            7
          ],
          "challenge_frames": [
            6
          ],
          "final_frame": 8,
          "final_status": "200",
          "credentials_sent": true,
          "digest_algorithm": "MD5",
          "granted_expires": "3600",
          "outcome": "registered"
        },
        {
          "user": "1002",
          "call_id": "8bq2Wf4kLm",
          "request_frames": [
            1,
            3
          ],
          "challenge_frames": [
            2
          ],
          "final_frame": 4,
          "final_status": "200",
          "credentials_sent": true,
          "digest_algorithm": "MD5",
          "granted_expires": "3600",
          "outcome": "registered"
        }
      ]
    }
  ],
  "conflicts": [],
  "facts": [
    {
      "frame": 7,
      "field": "sip.auth.username",
      "value": "1001"
    },
    {
      "frame": 8,
      "field": "sip.Status-Code",
      "value": "200"
    },
    {
      "frame": 8,
      "field": "sip.Contact",
      "value": "<sip:1001@192.168.56.21:5060;transport=udp>;expires=3600"
    },
    {
      "frame": 3,
      "field": "sip.auth.username",
      "value": "1002"
    },
    {
      "frame": 4,
      "field": "sip.Status-Code",
      "value": "200"
    },
    {
      "frame": 4,
      "field": "sip.Contact",
      "value": "<sip:1002@192.168.56.22:5060;transport=udp>;expires=3600"
    }
  ],
  "interpretation": "AI interpretation: skill #1 shows both users registered after normal digest challenges. No skill analyzed the INVITE, ACK, and BYE transactions, so the call outcome is not established by this report, although the tester reports a successful call.",
  "next_check": "Implement skill #2 (Call Setup & Teardown) and re-run the test."
}
